text,label,n_chars,n_words,type_token_ratio,avg_word_len,exclamation_count,question_count,ellipsis_count,quote_count,fear_word_rate
"Don’t worry about falling; they will keep you moving. If the cave you chose was short, you may notice that you don’t hit the end. If this happens, the floor will seem to level out regardless of the cave’s layout. You’ve been set on a path to the same place, and it is vital that you not open your eyes. If this doesn’t happen, don’t worry. If you had no technology and followed the previous instructions, the ritual is not for you. The fates have another destiny in mind for you, one that cannot be altered by a ritual such as this. You might hear whispering around you, may feel cool digits trailing across your back and chest. It will be so cold that it burns when they touch your bare skin. Do not react. They are simply curious to see one of bound flesh crossing through their realm. Unless you offend them, they will not do any intentional harm. Stay silent, keep your eyes closed, and continue moving forward. The whispers will grow louder as you go, angry voices rising above their whispered words, almost recognizable as English. It is especially important here that you do not react. This voices’ owners do not belong there. They are the poor souls who lost themselves in this realm, straying from the path yet not offending the hosts before they were beyond harm. That is why you must continue in a straight line. Stepping off the path will sever your soul, binding it eternally to a realm of shadow where the denizens do not want you.",human,1445.0,270.0,0.5851851851851851,4.225925925925926,0.0,0.0,0.0,0.0,0.011111111111111112
"There was nothing but woods behind him. Again, Preston sighed. Probably just for someone else. He felt a knot tighten in his chest. Preston looked up, envying all the children who talked or played together. It was times like these that he wished that he had his Pokémon game. “Pst!”
Half behind a tree and half hidden by the green shrubbery stood Hypno, with his stooped posture and swinging his pendulum. Preston smiled, and after making sure no one was watching him, edged toward the shrubbery. “Hello, little child,” Hypno said, cocking his head to the left like a bird. “Hi, Hypno,” Preston said, trying to keep his voice down. “Why did you run away yesterday?”
“I don’t like adults seeing me,” Hypno said. “Why?”
“They don’t like Pokémon.”

“Oh,” Preston said, nodding his head. No wonder why Mrs. Hinson was always trying to take away his Pokémon game. “What is your name, little child?”
“I’m Preston. Preston Michaels.”
“Well Preston,” he said. “I have something to show you.”
Hypno gestured behind him with his free hand, and then he turned and walked into the forest. Preston glanced back. As usual, everyone’s attention was everywhere but him. He turned and followed his Pokémon into the foliage. The shrubbery clung to Preston’s jeans, making him stop every so often to wrench his legs from the thicket. Hypno walked ahead, his right arm always held out swinging his pendulum. The smell of wet root made Preston’s nose wrinkle every time he broke a large weed.",human,1471.0,263.0,0.5931558935361216,4.311787072243346,1.0,3.0,0.0,24.0,0.0
"In my efforts to prove to myself that I was brave, I’d taken myself straight into harm’s way. And what was worse was that I’d taken my little brother; who I was meant to protect, along for the ride. The thing stayed just out of the weak range of the torchlight, the dim cone of light just enough to make out its outline against the trees behind it as it padded back and forth, a low warning growl rumbling continuously in its throat. I could see it only a little better than I had been able to in the house, just an outline, and the red reflection of the light in its eyes. It was powerfully built through the shoulders and forelegs, a small head on a large frame that tapered down towards its back legs. Maybe it had a tail? I couldn’t tell in the dark, all I could really see was those damn eyes. It just seemed… wrong somehow, twisted like the tree that marked the entrance to the part of the woods it seemed to live in. Pete was beginning to hyperventilate and my heart was hammering at a million miles an hour, but I knew I needed to try and stay calm to try and get us out of this mess. “Pete?” I asked, not taking my eyes off of the red eyes being reflected in front of me. “What?” he stammered. “We’re going to back away slowly, okay? Just stick with me, we’ll be fine. It doesn’t like the light”. I was praying that I was right; the thing seemed reluctant to come into the torchlight. We backed slowly out of the clearing and back down the path that we’d come in on.",human,1475.0,296.0,0.5236486486486487,3.8513513513513513,0.0,4.0,0.0,6.0,0.0033783783783783786
"For a moment, nothing happened. Then the rise coiled around the candy, closing in like a snake, and retracted. I didn’t realize how frozen I had become until my head swam from a lack of oxygen. Then I sprang into action, moving my legs to follow the retreating rise in the ground. It disappeared into a copse of trees, then vanished from sight. I stared at the plants before me. No, not plants. At least, not all of them. Broken fur rose in vertical lines along the edges of the trees. The brownish hue blended well with the bark. I wasn’t fooled. I stared up at the point where the fur stopped. It towered at least seven feet above the ground – much higher than my 5’ 2” frame. I listened. It breathed. “Look,” I offered shakily, pulling out a fistful of red gummy bears. “There’s plenty more.” I dropped them from my trembling hands onto the ground at my feet. There was a snort. Then a large head emerged from the shadows. It was covered in thick, soft, brown fur. Its two eyes, both five inches across, were jet black. Two tiny triangular ears sat atop its skull. There was no visible nose. And its razor-sharp canines would have presented an imposing threat, if it weren’t for the fact that they were misaligned in a massive, crooked underbite. “Ffffffssssnuuuuu?” it asked. Then it reached out a massive paw, clearly focused on my gummy bears. “Whoa!” I shouted, trying to look more intimidating than I felt. I stepped protectively over the candy. He snatched his paw back like I’d burned it.",human,1498.0,274.0,0.6204379562043796,4.233576642335766,1.0,1.0,0.0,9.0,0.0036496350364963502
"Forgive me if I’m curt, but I’ve had a shitty night. And honestly? I don’t see it getting any better. I don’t know where my girlfriend is. My clothes smell like fish guts. There are splinters in my hands leftover from the handle of the axe I have leaning against my desk here. Worst of all I can still hear the sound my dog made when… Let me start from the beginning. I met my girlfriend Abby when we were going to the same school in the city. A few of our mutual friends introduced us to each other and that was it. I fell hard for her and I guess she did the same for me, because after we graduated, she invited me to move in with her. The catch was it was into a place in her hometown of Darby, about two and a half hours away. She was going to rent a house from her aunt. She had a job lined up with a small outfit in town there making decent money. My diploma made it easy enough to get a job telecommuting from my home computer. Really, there was no compelling reason not to go. I really love this girl and to be honest, I had grown tired of the noise and the crowds that come with city living. Abby was worth giving country life a try. We were well into winter by the time both of our leases ran up on our separate apartments. We packed our things into a U-haul and drove it out of the city to our new house. The house is a nice place. Not big, but not tiny enough to force you to call it cozy.",human,1401.0,291.0,0.570446735395189,3.718213058419244,0.0,1.0,0.0,0.0,0.003436426116838488
"She didn’t seem too put off by my own frumpy charity shop clothes and overly friendly (desperate?) demeanour either, which was a huge relief. Her brother, Michael – a small, narrow shouldered kid with very pale skin and an awkward manner – and my own brother hit it off too after starting a conversation about video games, and went trotting off to Michael’s room immediately to play on his Xbox. I sensed the family had money – their house was bigger than ours, and a lot less shabby – and so Michael would probably have a lot of the latest games. After a nervous introduction, Katie and I soon got talking, and we sat in her kitchen swapping stories whilst her mum unpacked boxes around us. She seemed grateful that there was someone her own age in this strange, rural land; I, of course, was ecstatic. The summer went by in a happy haze: Katie and I spent most days together, wandering down to the lake for a swim, or hanging out in each other’s bedrooms, larking about online or watching movies. Our brothers, likewise, found companionship in each other, and Katie’s mum, who was from the area originally, made a friend in my own mum. When school came, Katie and I rode the bus together, and she assimilated effortlessly into our friendship group (another huge relief, as I’d been concerned that she might be a bit out of our league).",human,1337.0,242.0,0.6570247933884298,4.347107438016529,0.0,1.0,0.0,0.0,0.0
"I’m not sure when I started thinking of him again. It had been at least sixteen years. I had pretty much forgotten about him up till that point. I went about my life as a waitress and dishwasher for a small town diner. The only place to get food aside from the Jiffy-Mart and garage just up the street. The town had countless legends that involved death of some form involving creatures that most people laughed at. Late one night when only the regulars were there, everyone decided to pitch together and tell me some of the stories. I had just moved there two months before and still hadn’t had the time to listen in on the latest encounters with the local creatures. They started it off by telling me about the Rake and how it drove it’s victims to insanity by demanding impossible things from them or perching at the foot of their bed night after night waiting for them to wake up so it could kill them. I laughed it off. “That doesn’t sound that bad,” I said. “At least it was trying to get it over with.”
Nealy, the man who told the story, huffed in irritation. “Tell ‘er about the Operator.”
“The what?” I asked. “That sounds like a bad horror movie I saw once.”
“Don’t laugh.” Gina, the owner, said. “He’s real. Ever wonder why you don’t see kids in this town or why the school is shut down. He lives there. He takes children and then goes after their families. He dates back as far as anyone knows. He took the waitress you replaced and her son.”
“Uh-huh, and pigs fly.” I said.",human,1486.0,288.0,0.6041666666666666,3.986111111111111,0.0,1.0,0.0,16.0,0.017361111111111112
"The count now stands at eleven – nine being residents of Seal Cove, including the town’s Deputy Sheriff. They showed a quick clip of Sheriff Thompson, who looked more gaunt than ever. Only three bodies have been found, exhibiting what the reporter referred to as “heavy mutilation.” It doesn’t take much imagination to figure out exactly what that means. People have to know that it’s not safe anymore. That thing – whatever it is – has gotten bolder. It had to have started with Mr Dossit. He had awoken it at Loon Harbour, it seems. After that, it had lured him off somehow, made him follow it into the trees. Then it descended on his wife when she was alone and miles away from help, probably in Mr Dossit’s form. And Colby… poor innocent Colby… the thing had followed us back to Seal Cove in pursuit of him after he’d seen it at Loon Harbour. We had lured it straight to humanity. How many of these new cases are victims of the same evil? Is this all our fault? I don’t know if it will leave the woods long enough to come enter the city, but how will we know when it does? Each stranger you pass on the streets could be it in disguise. Each voice you hear on the phone could be a lie. The only safety, it seems, is to never be alone. Mr and Mrs Dossit, Colby… they had all been alone when it came for them. Maybe if I hadn’t abandoned Colby in the road that night, he’d still be alive. Tomorrow I board the bus and head back to Seal Cove for questioning by the Sheriff.",human,1473.0,287.0,0.5923344947735192,3.9825783972125435,0.0,3.0,0.0,2.0,0.017421602787456445
"The storm outside raged like a beast, its thunderous growls making the old house creak and groan as if it too were alive. I stood at the front window, the curtains billowing like a dark cloud around me, as the wind howled through the streets. Jacob's eyes, those piercing brown orbs, seemed to bore into my very soul as I gazed out at the tempestuous night.

Mason, our elderly neighbor, had warned us not to venture outside. He'd spoken of strange happenings on nights like this, when the wind was just right. But I felt compelled to disobey, to uncover the source of the unease that had settled over our small town like a shroud.

As I gazed out into the darkness, a shape began to take form, silhouetted against the flashes of lightning. Its mane, like a fiery halo",ai_base,768.0,140.0,0.7142857142857143,4.3428571428571425,0.0,0.0,0.0,0.0,0.02857142857142857
"Friday morning commute, the train lurched forward as I claimed my seat among the throngs of sleepy bodies. A beggar stood at the door, his eyes sunken, his hands cupped to receive coins. I watched him with a mix of disdain and guilt as he muttered a soft melody, his voice weaving through the murmurs of the passengers.

As we approached the next stop, I felt an itch on my palm, and I instinctively rubbed it. My hand closed around something small and metallic. I brought it out – a silver coin, its surface etched with strange symbols that seemed to writhe like living things. The beggar's eyes met mine, and for a moment, we locked gazes. His mouth twisted into a macabre grin.

The train pulled into the station, and I rose to let others pass. As I stepped off onto the platform, the beg",ai_base,791.0,145.0,0.7034482758620689,4.296551724137931,0.0,0.0,0.0,0.0,0.006896551724137931
"As I reached for the doorknob, my hand brushed against the cold metal of the caulked seam where the old wooden frame met the glass. The other side seemed to press against me, its presence like a held breath. Windows like empty eyes stared back, their frames warped and misshapen as if some ancient fingers had twisted them into grotesque grins.

I hesitated, the lock's mechanism groaning softly beneath my tentative touch. The air grew thick with an unnameable weight, as if the door itself was listening, waiting for the key to be turned, the bolt to slide free. My heart hammered behind my ribcage, urging me forward, warning me away. I knew I should not enter, that the silence beyond was a trapdoor to a realm where darkness seeped through cracks and crevices like a slow-moving tide.

But still I",ai_base,802.0,142.0,0.7464788732394366,4.52112676056338,0.0,0.0,0.0,0.0,0.02112676056338028
"As I descended into the crawlspace, the air grew thick with the scent of decay. Lindsay's voice echoed in my mind, ""Why are we doing this?"" Stephanie's laughter, once a nervous giggle, now seemed a mad cackle, as I felt the walls closing in. My roommate's words, ""Don't go down there,"" still lingered, but I had to see for myself.

The space was cramped, the ceiling barely inches above my head. Cobwebs clung to my face like sticky fingers, and I brushed them away, trying not to look at the others. Other shadows darted around the periphery, their dark forms shifting, refusing to be defined. The air vibrated with an eerie silence.

A large wooden beam stretched across the room, dividing it into two halves. I hesitated, my heart racing, wondering which side held the truth. The",ai_base,782.0,137.0,0.7883211678832117,4.481751824817518,0.0,1.0,0.0,4.0,0.014598540145985401
"As I went up the creaking stairs, the air grew thick with the scent of old books and decay. Granny's whispers echoed through the halls, her words indistinguishable from the creaking floorboards. Calvin's laughter, once so carefree, now sent shivers down my spine as I approached the top step.

The door to the attic was always locked, but tonight it swung open with an ease that sent a shiver down my spine. Melinda's voice whispered my name, drawing me into the darkness. I hesitated, feeling the weight of forgotten memories bearing down upon me.

Inside, the shadows seemed to writhe like living things. I called out for Calvin, but only the darkness responded. Something moved beneath the eaves, its presence palpable, yet unseen. And then, a faint whisper: ""Going...going...going..."" - a gentle reminder that",ai_base,813.0,135.0,0.7407407407407407,4.770370370370371,0.0,0.0,3.0,2.0,0.044444444444444446
"As I stood before the brimming vessels, I felt an insatiable want gnawing at my very core. The air was heavy with the scent of decay, and I could sense the weight of each vessel's contents bearing down upon me. The process of filling them had been slow and deliberate, as if some ancient hand had deliberately poured every last drop into the waiting containers.

I tried to tell myself I wasn't drawn to this place, that I didn't want to be here, but my feet seemed rooted to the spot. Fewer than I remembered, yet it felt as though I was surrounded by more faces than ever before. Happy memories taunted me, whispers of joy and laughter echoing through the stillness.

But I knew it was all a ruse. I felt it in the pit of my stomach, a growing unease that threatened to consume me whole. And when I",ai_base,800.0,151.0,0.6821192052980133,4.185430463576159,0.0,0.0,0.0,0.0,0.006622516556291391
"As I stepped onto the rickety bridge, the creaking beneath my feet was like a morbid welcome. Chris, my companion, lagged behind, reluctant to join me on this midnight walk. I paused, looking down at the dark water lapping against the pillars, and felt an inexplicable shiver.

The camera's red glow cast an eerie light on the surroundings, as if it too sensed something lurking just out of sight. I shone its beam towards Chris, who stumbled closer, his eyes wide with unease. ""What's wrong?"" I whispered, but he shook his head, his smile faltering.

I took another step forward, the wooden planks groaning beneath my weight. The thing that dwelled in the shadows seemed to stir, as if awakened by our presence. I could feel it drawing near, its presence seeping into my bones. I tried",ai_base,786.0,137.0,0.781021897810219,4.54014598540146,0.0,1.0,0.0,2.0,0.014598540145985401
"The smell of graphite lingered in the hospital's corridors, a constant reminder of the burnt offerings left behind by Dr. Thomas Berkley's experiments. Harriet couldn't shake the feeling that something was watching her, its presence seeping into the walls like ink on paper.

Seemed she'd lost herself in the labyrinthine halls, the sterile scent of antiseptic masking the charred remains of what once were human beings. Every step echoed through the silence, amplifying the creaks and groans of the old building. Berkley's whispers seemed to follow her, his voice a gentle breeze on a summer day, except it wasn't gentle – it was sinister.

As Harriet turned a corner, a faint light flickered at the end of the hall. She approached it cautiously, her heart racing with every step. The light grew brighter, illuminating the name ""Berkley",ai_base,837.0,136.0,0.7279411764705882,5.0,0.0,0.0,0.0,1.0,0.007352941176470588
"As I drive for Cerber, the darkness seeps into my bones like a chilled mist. I've been on this route before, but it's never felt so long. The GPS guides me through winding roads, leading me deeper into the heart of nowhere. Sleep creeps in, a heavy blanket suffocating my consciousness. I shake off the drowsiness, my grip tightening around the wheel.

Went down a road, just a road, nothing special about it. Maybe that's why I went down it. Good thing I did, or maybe not. Now I'm here, in this place where shadows writhe like living things. Insane thoughts swirl in my mind, a maelstrom of what-ifs and maybes. The seat creaks beneath me, a groan that harmonizes with the howling wind.

Covers the distance between me and... whatever is",ai_base,739.0,133.0,0.7518796992481203,4.360902255639098,0.0,0.0,1.0,0.0,0.015037593984962405
"As I entered the kitchen, the candle's flame danced, casting eerie shadows on the walls. I'd given up trying to explain it – the strange noises, the faint scent of decay – but something about this place still made me shiver. I'd tried to ignore the whispers, but they persisted, echoing in my mind like a mantra.

I approached the counter, where a metal dish lay, its surface smeared with a viscous residue. It looked as if someone had been feeding it, or... something else. Giving in to morbid curiosity, I touched the cold metal, and a chill ran down my spine. My heart began to race as I thought about what might have been going on here, what secrets were hidden beneath the surface.

Suddenly, the candle's light flickered, and I felt a presence behind me. I tried to turn, but my legs wouldn't move.",ai_base,804.0,144.0,0.6944444444444444,4.368055555555555,0.0,0.0,1.0,0.0,0.020833333333333332
"As I knocked on the creaking door, the wind seemed to carry the name ""Tucker"" on its whispers. Abby had called me here, promised me answers about her disappearance, but something felt off. The once-familiar house loomed before me, its windows like empty eyes. I pushed the thought aside, focusing on the task at hand.

The door swung open with a dreadful screech, as if it had been waiting for me all this time. A chill ran down my spine as I stepped inside, calling out Abby's name. No response. I began to search room by room, each space mirroring the last - dusty, abandoned, and silent. But I couldn't shake the feeling that I was being watched.

Every creak of the floorboards made me jump, my heart racing with anticipation. Where was she? The words ""Find me"" etched into",ai_base,777.0,140.0,0.75,4.3428571428571425,0.0,1.0,0.0,4.0,0.02142857142857143
"I Discovered the Meaning Of Life

As I walked through the streets, my feet heavy with the weight of countless letters, I couldn't shake the feeling that I was being watched. The wind carried whispers, snippets of conversations, and the rustling of envelopes as they slid from mailboxes like restless spirits. People hurried past me, their faces a blur, but I sensed their eyes lingering on mine, weighing me down.

I tried to shake off the unease, focusing on the stack of letters clutched in my hand. So many had arrived in recent days, addressed to no one and everyone, bearing cryptic messages scrawled in red ink: ""Take advantage."" The words seared themselves into my mind, echoing through my dreams.

I sent out letters of my own, hoping to find answers, but they seemed to vanish into the void. No responses came. The silence was",ai_base,835.0,145.0,0.696551724137931,4.5793103448275865,0.0,0.0,0.0,2.0,0.006896551724137931
"I settled into the worn armchair, the softness of the cushion enveloped me like a shroud. Felt a presence hovering just beyond the edge of perception. Kylie's perfume clung to my skin like a damp mist. The room seemed to shrink around me, walls closing in on whispers.

Breathing grew louder, as if an unseen force was mimicking mine. Every pulse echoed through my ears, a macabre accompaniment to the ticking clock. I knew something was behind me, yet dared not turn. The air vibrated with an expectant stillness, a sense of waiting. And then, a faint rustling, like the slow unwrapping of bandages from a mummy's limbs. The sound drew closer, louder, until I felt it brush against the nape of my neck...",ai_base,705.0,124.0,0.7338709677419355,4.508064516129032,0.0,0.0,1.0,0.0,0.008064516129032258
"As I stepped into the dimly lit room, the air clung to me like a damp shroud. The walls seemed to press in, the shadows twisting around me like grasping fingers. I'd been away for so long, but the house still felt mine, its secrets and silences waiting patiently.

Alan's voice whispered my name, his tone a low hum, like the distant thrumming of a forgotten engine. I followed the sound, my heart pounding against the silence. In the living room, a single chair crouched, its seat cracked and worn. The coffee table was littered with dusty artifacts, relics of a life left behind.

I heard the creaking floorboards beneath my feet, a cadence that echoed through the empty halls. In the kitchen, a half-empty bottle of water sat on the counter, condensation beading on the glass. I hes",ai_base,785.0,140.0,0.7285714285714285,4.442857142857143,0.0,0.0,0.0,0.0,0.007142857142857143
