text,label,n_chars,n_words,type_token_ratio,avg_word_len,exclamation_count,question_count,ellipsis_count,quote_count,fear_word_rate
"As I walked up the crumbling stairs, the back of my neck prickled with every creaking step. The air thickened around me, heavy with the scent of dampness and decay. Every light flickered with an otherworldly intensity, as if the bulbs themselves were alive.

In the dim hallway, I slowed to a halt, my hand reaching for the banister to steady myself. The walls seemed to close in, their peeling paint exfoliating like skin. My heart quickened, its rhythm matching the pulse of the lights. Eyes watched me from every corner, unseen but palpable.

A faint hum grew louder, vibrating through my entire being. My grip tightened on the railing as I ascended further, the wooden slats worn smooth beneath my palms. Ahead, a door loomed, partially hidden by shadows.

I pushed it open, and the room flooded with torch",ai_finetuned,810.0,140.0,0.7428571428571429,4.607142857142857,0.0,0.0,0.0,0.0,0.014285714285714285
"As I walked through the forest, the ground beneath my feet grew spongy, as if it were alive and trying to swallow me whole. The trees towered above, their branches like skeletal fingers reaching for the sky. I'd been warned not to stray from the path, but I had to see this cursed place for myself.

The air was heavy with the sweet scent of rotten fruit, like someone had left a bag of rotting candy on the forest floor. I coughed, covering my mouth with my hand. My head spun with every step, as if the ground itself was tilting against me.

Suddenly, a tree loomed before me, its trunk twisted and gnarled. I stared up at it, transfixed by the way its bark seemed to writhe and twist, like living vines crawling over its surface. The branches rose higher and higher, until they disappeared into the",ai_finetuned,801.0,148.0,0.7027027027027027,4.27027027027027,0.0,0.0,0.0,0.0,0.0
"As we walked through the crumbling city streets, my girlfriend Abby clung to my arm, her eyes wide with unease. We'd been searching for hours, but I knew we wouldn't find it. It wasn't like any other place, not even remotely close. I could feel the weight of its presence drawing us closer, an unseen force guiding our steps towards the abandoned house on the hill.

""Are you sure this is it?"" she whispered, as if the walls themselves might be listening.

I nodded, trying to reassure her, but my heart raced with excitement and fear. We'd been going over old maps, scouring records, and talking to locals who claimed to have seen things – heard whispers of strange occurrences, of unexplained lights flickering in the windows. Enough was enough; I had to know the truth.

The house loomed before us, its once-white walls now a",ai_finetuned,828.0,146.0,0.773972602739726,4.47945205479452,0.0,1.0,0.0,2.0,0.0136986301369863
"The Mannequin Farm

As I stepped into the old abandoned farmhouse, Katie's laughter echoed through my mind. She had always loved the idea of playing hide-and-seek among the dusty rows of mannequins, their plastic faces frozen in perpetual smiles. Michael had joined us that day, his eyes gleaming with mischief as we crept through the rooms, searching for each other.

But it was when we stumbled upon the huge storage room that everything changed. Rows upon rows of mannekins stood like sentinels, their limbs stiffly posed in outdated poses. Relief seemed to wash over me as I realized the place was empty, devoid of any life – human or otherwise. Or so I thought.

I called out for Katie, but only the creaking of wooden floorboards replied. A chill ran down my spine as I called out again, this time receiving an eerie silence",ai_finetuned,830.0,145.0,0.7655172413793103,4.586206896551724,0.0,0.0,0.0,0.0,0.0
"The whole time I'd heard whispers about this town, but never thought much of it. Until I started driving down Main Street at dusk. The asphalt seemed to shift and writhe like a living thing under my tires. Night was falling fast, swallowing the crumbling buildings whole.

I pulled into the diner for a cup of coffee, and that's when I saw her – the waitress, her face a pale oval of exhaustion. She greeted me with a tired smile and poured steaming black coffee into a chipped mug. As she walked away, her eyes flickered towards mine, and for a moment, I could've sworn she laughed. A low, wet sound, like something had been awakened from a long slumber.

The air inside the diner was thick with an unspoken understanding, as if we all knew something we weren't supposed to. The hum of the neon sign outside seemed to v",ai_finetuned,820.0,150.0,0.72,4.32,0.0,0.0,0.0,0.0,0.013333333333333334
"Loon Harbour

The fog crept off the waves like a living entity, tendrils curling around the lighthouse tower as if to strangle it. I stood at the top, my eyes fixed on the sea below, where a small seal poked its head above the surface. Colby, the sheriff, had warned me not to go ashore tonight, but I had to know what lay beyond the treacherous rocks.

The wind died, and the silence was oppressive, as if something was listening. The sound of dripping water echoed through the cove, and I felt an icy finger trace the length of my spine. A shiver coursed through my veins as I descended into the darkness, alone.

As I reached the water's edge, I spotted a figure standing by the old lifeboat, its face obscured by the shadows. It was him – the thing that had been",ai_finetuned,766.0,143.0,0.6993006993006993,4.195804195804196,0.0,0.0,0.0,0.0,0.02097902097902098
