text,label,n_chars,n_words,type_token_ratio,avg_word_len,exclamation_count,question_count,ellipsis_count,quote_count,fear_word_rate
"As I stood at the edge of the clearing, the air thickened, heavy with the felt presence of unseen eyes. The trees seemed to lean in, their branches tangling around me like skeletal fingers. I couldn't help but feel drawn to the distant flames that danced across the landscape, their golden light illuminating the darkness.

The was a burning need within me, a primal urge to join the dance. My feet moved of their own accord, carrying me closer to the inferno. The heat washed over me, real and palpable, as if the fire itself were reaching out to claim me.

But something stopped me just short of the flames. A voice, low and menacing, whispered my name. ""Come,"" it hissed. ""Join the dance."" The words echoed through my mind, growing louder, more urgent.

I hesitated, feeling the burning sensation spread throughout my body. It",ai_base,829.0,145.0,0.6896551724137931,4.496551724137931,0.0,0.0,0.0,4.0,0.013793103448275862
"The Mena's eyes gleamed like polished stones as she stood before the crumbling wall, her hand grasping the damp stone roughness. The canker of night air clung to her like a shroud, heavy with secrets. Ahead, the darkness yawned, an abyssal pit that seemed to whisper her name.

She took a slow step forward, the sound echoing through the desolate silence. Her other foot hesitated, then lurched to catch up, as if drawn by some unseen force. The wall loomed behind, its ancient bricks exuding a malevolent presence.

As she moved further into the void, the shadows deepened, assuming twisted forms that lunged at her from all sides. Her breath came quick and shallow, the only sound breaking the oppressive stillness. And then, a small, forgotten thing rolled across the ground, a tiny ball of dust and despair",ai_base,810.0,138.0,0.7463768115942029,4.702898550724638,0.0,0.0,0.0,0.0,0.028985507246376812
"As I descended into the darkness, the air grew thick with the scent of damp earth and decaying leaves. The path ahead wound on, vanishing into the abyss like a snake slithering into its own shadow. I felt an insidious worry creeping up my spine, tendrils of unease curling around my heart.

The trees seemed to close in, their branches tangling above me like skeletal fingers. I pushed forward, my footsteps echoing off the walls of the cavernous cave. The silence was oppressive, heavy with secrets waiting to be unearthed. Every step felt like a deliberate step further into the unknown, as if I were being led deeper into some ancient, malevolent ritual.

My eyes scanned the darkness, searching for any sign of life. But there was none. Only the echoes of my own ragged breathing, and the soft rustle of dry soil beneath my feet.",ai_base,833.0,146.0,0.7191780821917808,4.561643835616438,0.0,0.0,0.0,0.0,0.02054794520547945
"As I settled into my chair, the warm breeze rustling the shrubbery outside carried the distant hum of crickets, a gentle melody that harmonized with the soft ticking of the grandfather clock behind me. Preston's voice whispered sweet nothings in my ear, his words dripping with honeyed sincerity as he began to recite an old lullaby.

""Hypno, oh Hypno, bring us sleep,""
he sang, his voice weaving a spell of tranquility around me. I felt my eyelids grow heavy, the weight of fatigue crushing down upon me like a shroud.

But as his voice trailed off, the creaking of the old wooden floorboards beneath my feet became more pronounced, the groans and groans of the ancient house itself seeming to sway in time with the gentle swaying of the candelabra on the nearby table. The flames danced, casting flick",ai_base,803.0,139.0,0.697841726618705,4.640287769784172,0.0,0.0,0.0,2.0,0.0
"As I walked down the deserted alley, the red lights that lined the walls seemed to pulse in time with my footsteps. I couldn't help but feel like an insect drawn to a deadly flame. The air was heavy with the scent of decay, and I could feel it settling in the back of my throat like a cold mist.

I slowed my pace, my eyes fixed on the flickering glow ahead. It seemed to be calling me, drawing me deeper into the heart of this forsaken place. I felt a creeping sense of dread as I realized I had no idea where I was going, only that I needed to get there.

My torchlight cast eerie shadows on the walls, making it seem like something was moving just out of sight. I spun around, my heart racing, but there was never anything there. Or so I thought.

As I turned a corner, I caught a glimpse of",ai_base,794.0,158.0,0.6329113924050633,3.8987341772151898,0.0,0.0,0.0,0.0,0.012658227848101266
"As I walked, the ground beneath my feet grew spongy, like a thousand tiny fingers grasping for purchase. The trees loomed above, their branches tangled together like skeletal hands, as if attempting to ensnare me. I rose to my toes, my eyes fixed on the dark, gnarled trunks.

The air was heavy with the sweet scent of rotting candy, a morbid perfume that clung to my skin like a shroud. My head spun with every step, as if the very earth itself was trying to turn my thoughts to mush. I stumbled, and my gaze fell upon the plants surrounding me – their leaves seemed to stare back, their petals twisted into grotesque, inhuman grins.

I pushed forward, driven by a morbid curiosity, the trees seeming to draw closer with each step. The ground beneath me began to rise, like a great",ai_base,782.0,141.0,0.6737588652482269,4.375886524822695,0.0,0.0,0.0,0.0,0.0070921985815602835
"The city loomed above me like a diseased corpse, its streets slick with an unholy grime that clung to my skin like a bad omen. I'd been walking for hours, searching for the Marwyndoon, that notorious house on the hill where my girlfriend had vanished into thin air. They said it was a place of dark magic, where the veil between worlds grew taut as a strangler's garrote.

As I crept up the winding path, the trees seemed to twist and writhe around me, their branches grasping like skeletal fingers. I could feel Abby's presence, a whispered echo in my mind, drawing me closer to the house that loomed before me. Same house, different door. Different, yet the same. Going up the steps, I felt the weight of years settling upon me, as if the very fabric of reality was unraveling",ai_base,778.0,141.0,0.7092198581560284,4.382978723404255,0.0,0.0,0.0,0.0,0.014184397163120567
"The air was heavy with the scent of forgotten fabric as I stepped into the mannequin farm. Katie's plastic smile seemed to mock me from behind her glassy eyes, her polyester skin gleaming in the faint light. Michael's whispers echoed through my mind, his soft voice a gentle breeze on a summer day. 

We had come here seeking relief from the summer heat, but the sweltering sun beat down upon us like a physical presence, weighing us down. My brother and I walked hand in hand, our footsteps silent on the dusty ground. We were alone, yet it felt like we were being watched.

We wandered deeper, the mannequins looming around us like sentinels. Some wore clothes that seemed to have been hastily discarded, while others stood bare, their faces frozen in perpetual fear. My brother's grip tightened around mine as we approached a group of them,",ai_base,843.0,147.0,0.7619047619047619,4.598639455782313,0.0,0.0,0.0,0.0,0.02040816326530612
"The whole time, I'd heard whispers about this town's cursed night. How it came alive with an unholy presence that drew you in like a moth to flame. But I never believed the stories. That was, until I walked into the diner on my first evening in town.

The neon sign creaked above me, casting flickering shadows across the Formica tables. The waitress, a tired-eyed woman with a too-bright smile, took my order with a practiced ease that made me uneasy. She laughed, a sound that didn't quite reach her eyes, as she scribbled down my request.

The night air outside seemed to seep into the diner, carrying the scent of damp earth and something else - something that made my skin crawl. The townspeople were scarce, but those who lingered at the counter eyed me warily, their faces twisted into leers. Started",ai_base,807.0,144.0,0.7430555555555556,4.451388888888889,0.0,0.0,0.0,0.0,0.027777777777777776
"As I stepped off the ferry onto the crumbling dock of Loon Harbour, the salty air clung to my skin like a damp shroud. The sky was a sickly shade of grey, as if the very clouds themselves were putrid with decay. Sheriff Colby's voice carried across the water, his words dripping with an unspoken menace. ""Stay close to the shore, don't go pokin' around.""

I watched as he handed a weathered old fisherman a small packet of soggy papers. The man's eyes, sunken and ancient, locked onto something in the distance - a dark shape slumping against the rocky outcropping that jutted into the cove. A seal, its fur matted and stained, seemed to be watching me too.

The wind picked up, rustling the dry reeds that swayed like skeletal fingers above the waves. I",ai_base,754.0,135.0,0.7703703703703704,4.4222222222222225,0.0,0.0,0.0,2.0,0.007407407407407408
"As I stepped out of the creaking old house, the wind whipped my face, pulling my hair back like fingers. Thunder rumbled in the distance, growing louder with each passing moment. Jacob mason's eyes seemed to bore into the back of my skull as I turned to glance back at the door. It was shut, the lock secured from the inside.

The porch creaked beneath my feet as I took another step closer to the edge. Outside, the trees swayed like skeletal fingers, grasping for me. The lion's roar echoed through the air, the sound waves vibrating against my chest.

I had kept it locked away all these years, hidden behind secrets and lies. But the wind howled like a chorus of restless spirits, warning me that it would not be contained. And now, it called to me, its voice growing louder with every passing moment. The front",ai_finetuned,815.0,148.0,0.6959459459459459,4.358108108108108,0.0,0.0,0.0,0.0,0.006756756756756757
"The commuter train lurched forward, belching smoke into the morning air as I clutched my briefcase tight. Friday's commute was always the worst – the one day I had to face my boss's inescapable gaze. As we rumbled towards the city center, I noticed a beggar huddled at the rear of the carriage, his eyes fixed on me. His skin was sallow, his clothes tattered, but something about him sent shivers down my spine.

I tried to focus on the newspaper in my hand, but my mind kept wandering back to the beggar. Why did he stare at me so intently? Was it merely for alms or something more sinister? I felt a tap on my shoulder. The beggar stood before me, his eyes burning with an unnatural intensity. ""Friday, isn't it?"" he whispered, his voice like rusty hinges",ai_finetuned,757.0,138.0,0.7101449275362319,4.318840579710145,0.0,3.0,0.0,2.0,0.0
"As I stood before the front door, my hand hesitated on the brass doorknob. The windows, once bright and welcoming, now seemed to stare at me like empty eyes. I'd forgotten the key, of course – as if that were the only reason I'd been summoned here tonight. 

The air grew thick with an unseen presence, like a mist that clung to my skin. I turned to the side, peering through the glass into darkness, trying to recall what was supposed to happen next. But each pane reflected a different room, a different life, until my own face stared back, distorted. 

I reached for the lock, my fingers brushing against something smooth and cold. As I turned it, the click echoed through the silence like a promise. The door creaked open, revealing shadows that seeped across the floor, tendrils reaching for me like gras",ai_finetuned,809.0,143.0,0.7202797202797203,4.468531468531468,0.0,0.0,0.0,0.0,0.03496503496503497
"I crept through the crawlspace, my heart racing with every creak of the ductwork above me. Lindsay had warned me about this place, but I'd never believed her. Now, as I moved deeper into the dark, cramped space, I realized she'd been trying to prepare me.

The air was thick with dust and the stench of decay. I could feel the weight of the house bearing down on me, the same oppressive sensation that made me question why I'd ever agreed to room with Stephanie in the first place.

As I turned a corner, I saw it: a large, padlocked door. My heart skipped a beat. What was behind it? What horrors lurked in the shadows, waiting for me?

Stephanie's laughter echoed through my mind, cold and mirthless. She'd always seemed so normal, so unassuming. But what secrets lay",ai_finetuned,769.0,139.0,0.697841726618705,4.35251798561151,0.0,2.0,0.0,0.0,0.02877697841726619
"The house creaked and groaned as I stepped inside, the air thick with the scent of decay and rot. Granny's rocking chair sat motionless, its worn wooden arms stretching out like skeletal fingers. I felt a shiver run down my spine as I noticed the dusty vases on the mantle, their once-proud flowers now wilted and gray.

""Calvin?"" I called out, my voice echoing off the walls. ""Melinda?""

No response. Just the oppressive silence and the feeling that I was being watched. I tried to shake it off, telling myself it was just my imagination playing tricks on me. But as I moved deeper into the house, I couldn't shake the sensation that I was being pulled towards something... something dark and ancient.

I found Melinda's room next, her bed unmade and her clothes scattered all over the floor. A photo of her",ai_finetuned,808.0,144.0,0.6944444444444444,4.423611111111111,0.0,2.0,1.0,4.0,0.006944444444444444
"The darkness crept in like a thief, stealing the last shreds of my sanity as I waited for the dawn to rise. The want had grown unbearable, a gnawing sensation that refused to subside. I tried to focus on the process of scraping together the last remnants of my thoughts, but my mind was a jumbled mess of fear and despair.

I had always been so sure of myself, so convinced that I could overcome any obstacle, but now I felt like a mere puppet dangling from the strings of my own madness. The more I struggled, the fewer my options seemed, until I felt like I was drowning in an ocean of uncertainty.

I knew I wasn't alone. I could feel their presence, lurking just beyond the edge of perception, waiting for me to succumb to their will. They whispered sweet nothings in my ear, tempting me with promises of peace and tranqu",ai_finetuned,825.0,154.0,0.6428571428571429,4.240259740259741,0.0,0.0,0.0,0.0,0.025974025974025976
"As I crossed the rickety bridge, the wooden planks groaning beneath my feet, I couldn't shake the feeling that Genevieve's smile was watching me from the trees. The moon hung low, casting long shadows that seemed to reach out like skeletal fingers. Chris's voice whispered in my ear, ""She's waiting."" I quickened my pace, the creaking of the bridge growing louder, until it sounded like whispers. In the distance, the old movie theater loomed, its screen aglow with a flickering image, a silent film playing in reverse.

I walked faster, my heart pounding in my chest, as if Genevieve's presence was drawing closer. The air grew colder, heavy with the scent of damp earth and rot. I felt her breath on the back of my neck, sending shivers down my spine. Suddenly, the bridge gave a loud",ai_finetuned,786.0,137.0,0.7299270072992701,4.562043795620438,0.0,0.0,0.0,2.0,0.014598540145985401
"As I entered the hospital's abandoned wing, the scent of burnt rubber and sweat clung to me like a shroud. Dr. Thomas's whispered name echoed through my mind, taunting me like a siren's song. I seemed to recall Berkley's words - ""It was the only way to save her"" - but Harriet's face, forever etched on my memory, seemed to scream silently at me from the shadows.

I followed the faint trail of graphite smudges leading down the dimly lit corridor, each step more treacherous than the last. Home, once a haven, now seemed a distant memory, and I knew I was being drawn further into the darkness.

A flickering light beckoned me towards a door, its metal handle smeared with crimson stains. My hand trembled as I grasped it, feeling an unseen force urging me forward. The",ai_finetuned,770.0,136.0,0.7352941176470589,4.477941176470588,0.0,0.0,0.0,2.0,0.029411764705882353
"I drive for Cerber. The darkness creeps in through the open windows, seeping into my bones like a chill. My eyes feel gritty from lack of sleep, but I keep driving. We're running late.

Went to the diner for a cup of coffee, but it was too crowded. Sat in the parking lot instead, waiting for the caffeine to kick in. Maybe that's what they mean by ""good vibes."" Now the engine purrs softly, a lullaby in this dead-end town.

Enough moonlight seeps through the clouds to cast an eerie glow on the dashboard. My hands grip the wheel tightly, as if holding onto something precious. They should be giving me a raise for this kind of dedication. But who's watching?

The seat creaks beneath me, protesting every bump. It sounds like a sigh. Insane thoughts flicker at the corners of",ai_finetuned,778.0,142.0,0.7464788732394366,4.302816901408451,0.0,1.0,0.0,2.0,0.014084507042253521
"As I entered the old house, the air thickened around me like fog on a winter's night. I'd been given a key to the kitchen, where my grandmother had spent countless hours cooking up a storm. But something felt off, like the very walls were giving birth to a sense of unease.

I tried to shake it off as mere paranoia, but the creaks and groans of the ancient woodwork seemed to whisper secrets in my ear. I think it was then that I noticed the candle burning in the corner, its flame flickering like a dying sigh. It seemed to be watching me, drawing closer with every passing moment.

As I approached the counter, the scent of burnt offering wafted up, making my stomach turn. Lips pursed in distaste, I reached for the metal tea kettle, its weight heavy in my hand. Giving in to morbid curiosity",ai_finetuned,796.0,148.0,0.6891891891891891,4.25,0.0,0.0,0.0,0.0,0.013513513513513514
"As I walked up the cracked sidewalk, the name ""Tucker"" etched into the mailbox seemed to writhe like a snake on the surface of my skin. The trees creaked, as if they were old bones shifting in the darkness. Abby's voice whispered my name, but I knew it was just the wind. Or so I told myself.

The porch creaked beneath my feet, the wooden slats groaning under the weight of secrets. I pushed open the door, which hung crookedly on its hinges, as if it had been forced shut by some unseen hand. A chill crept up my spine as I stepped inside. The air was stale, heavy with the scent of decay and something else - something almost sweet.

I called out again, my voice echoing through the empty rooms. No response. But I knew I wasn't alone. I searched room after room",ai_finetuned,765.0,144.0,0.7013888888888888,4.145833333333333,0.0,0.0,0.0,2.0,0.020833333333333332
"I Discovered the Meaning Of Life

As I sorted through the morning's mail, a chill crept up my spine like a slow-moving frost. The ordinary envelopes, addressed to strangers, seemed to whisper secrets I wasn't meant to hear. A postcard from Grandma, worn around the edges, caught my eye – she'd written about the weather. But it was the small, white letter slipped between the pages that made my heart quicken. No return address, no name, just a single sentence typed in bold black ink:

""You will receive your package soon.""

Days passed, but the silence was oppressive. Every knock at the door, every buzz of the phone, made me jump. And then, it came: a box wrapped in brown paper, tied with twine. No note, no indication of who might have sent this thing. People walked by outside, oblivious to the weight settling",ai_finetuned,817.0,144.0,0.7777777777777778,4.451388888888889,0.0,0.0,0.0,2.0,0.013888888888888888
"I settled into the worn armchair, feeling the familiar contours of its velvet upholstery beneath me. Kylie's perfume lingered on the cushions, a faint whisper of sweet despair. The room was dark, lit only by the soft glow of my phone's screen as I scrolled through her messages.

At first, the silence was comforting, a blanket that wrapped around me like a shroud. But as the minutes ticked by, I began to feel it - a presence, heavy and oppressive, like a weight pressed upon my chest. My breathing grew louder, echoing off the walls as I tried to shake the feeling. The air seemed to thicken, like syrup drizzling down my throat.

I couldn't quite pinpoint the source, but it felt as though someone - or something - was watching me from just out of sight. I knew it was there, lurking, waiting for its moment to strike.",ai_finetuned,822.0,146.0,0.6986301369863014,4.431506849315069,0.0,0.0,0.0,0.0,0.0136986301369863
"As I stepped into the dimly lit room, I could feel the air grow thick with an unseen presence. The scent of damp earth and decay clung to my skin, making me shudder. I had been away for so long, and yet this place remained unchanged - the same dusty furniture, the same faded curtains, the same eerie silence.

I began to make my way through the familiar spaces, searching for any sign that Alan was here, waiting for me. But every room seemed empty, every cupboard bare. My footsteps echoed off the walls as I called out his name, my voice growing hoarse from the fear that lurked beneath.

And then, suddenly, I heard it. A faint whisper, like a whispered promise, echoing through the stillness: ""Coming...coming..."" The hairs on the back of my neck stood on end as I spun around, desperate to locate the source",ai_finetuned,813.0,148.0,0.722972972972973,4.277027027027027,0.0,0.0,2.0,2.0,0.013513513513513514
"As I walked into the abandoned church, the smell of damp stone and forgotten prayers clung to my skin like a shroud. Felt, yet unseen, a presence lurked, its waspish hum vibrating through every creaking joint. The walls, once kissed by sunbeams, now hung in darkness, as if the light itself had been devoured. The air, thick with anticipation, quivered with an electric charge that made my skin crawl.

I was drawn, helpless, to the nave, where a lone candle flared like a beacon on a desolate shore. Its flames danced, a macabre waltz, as if beckoning me deeper into the heart of this charnel house. The fire's crackle grew louder, more urgent, until it seemed to be directed at me alone.

Suddenly, the shadows coalesced into something tangible, its face",ai_finetuned,756.0,131.0,0.7786259541984732,4.572519083969466,0.0,0.0,0.0,0.0,0.022900763358778626
"As I stood before the crumbling wall, the menea of forgotten centuries whispering secrets in my ear, I felt the hand of dread creep up my spine. The moon, a bloated crescent, hung low in the sky like a diseased eye, illuminating the path ahead. The air was heavy with the stench of decay, and I couldn't shake the feeling that something lurked just beyond the threshold.

I raised my hand to push aside the ivy-covered stone, but it seemed to resist my touch, as if rooted to the earth by some unseen force. Suddenly, a chill wind lunged forward, extinguishing the flickering torches that lined the path. I stumbled back, my heart racing, and when I turned to regain my footing, I saw him.

Tall, gaunt, his eyes aglow with an otherworldly light, he loomed",ai_finetuned,756.0,137.0,0.7226277372262774,4.350364963503649,0.0,0.0,0.0,0.0,0.0
"The path unwinds before me like a funeral shroud, the trees looming like skeletal fingers as I make my way towards the gate. Worry creeps into my mind like a cold draft on a winter's night. The air is heavy with an unspoken ritual, one that only the keepers of this realm understand.

As I draw closer, the gate comes into view - ancient, weathered wood, adorned with strange symbols that seem to pulse with a malevolent life. My heart quickens its pace, pounding out a morbid rhythm against my ribcage.

I push open the creaking door, the sound echoing through the stillness like a scream. Beyond lies a cave, its darkness seeming to swallow me whole. I step inside, my eyes adjusting slowly to the absence of light.

Suddenly, the air is filled with the soft, wet rustle of movement. Eyes appear",ai_finetuned,797.0,142.0,0.6971830985915493,4.443661971830986,0.0,0.0,0.0,0.0,0.035211267605633804
"As I settled into Preston's creaking armchair, the scent of damp earth and decaying leaves wafted up from the old books scattered about. He'd invited me to his study, the one he claimed was full of secrets, but I sensed it was really just a place where the walls whispered dark tales to each other. He gestured for me to take a seat beside the window, where the shrubbery outside seemed to writhe like tentacles.

""Hypno's gift, you know,"" he whispered, eyes glinting with an unholy light. ""The art of inducing sleep, then harvesting the dreams. A game, really."" His fingers drummed a staccato beat on the armrest as he spoke. Behind him, the ticking clock's rhythm quickened, its pendulum swinging like a metronome marking time.

I shivered, despite the",ai_finetuned,754.0,130.0,0.7538461538461538,4.607692307692307,0.0,0.0,0.0,4.0,0.015384615384615385
